{
  "$schema": "../../schemas/recipe.schema.json",
  "slug": "stronger-agents-langchain-langgraph",
  "order": 4,
  "eyebrow": "Orchestration",
  "title": "Stronger Agents with LangChain and LangGraph",
  "upcoming": false,
  "tagline": "Use a typed LangGraph to route requests, cap work, and reduce time to first useful response.",
  "difficulty": "intermediate",
  "estimatedReadingTime": "13 min",
  "estimatedRunTime": "6 min",
  "stack": {
    "primary": ["nebius-agentkit", "langchain", "langgraph"],
    "secondary": ["fastapi", "openai-sdk", "structlog", "prometheus", "docker"]
  },
  "tags": ["agent", "langchain", "langgraph", "orchestration", "streaming", "state"],
  "story": {
    "problem": "The first three cookbooks work, but a path that spends 40 seconds, 1421 input tokens, and 535 output tokens on a single answer still feels too slow for production.",
    "solution": "Rebuild the agent loop as a LangGraph state graph: a deterministic route node chooses a direct or deliberate path, LangChain prompt templates prepare messages, and graph events stream back to the route before the model finishes.",
    "outcome": "A faster orchestration skeleton that can skip unnecessary work today and later grow into durable execution, persistent context, interrupts, evaluators, and guardrails without turning the FastAPI route into orchestration glue."
  },
  "prerequisites": [
    "Python 3.12+",
    "uv installed (https://docs.astral.sh/uv/)",
    "A Nebius API key",
    "Docker (optional)"
  ],
  "models": [
    { "id": "Qwen/Qwen3-30B-A3B-Instruct-2507", "role": "primary" }
  ],
  "assets": {
    "hero": "assets/hero.png"
  },
  "quickstart": {
    "clone": "git clone https://github.com/nebius/nebius-partner-cookbook && cd nebius-partner-cookbook/cookbooks/04-stronger-agents-langchain-langgraph",
    "configure": "cp .env.example .env  # then fill NEBIUS_API_KEY",
    "run": "uv sync && make dev"
  },
  "endpoints": [
    {
      "method": "POST",
      "path": "/agent/run",
      "streaming": true,
      "description": "Run the agent against a user prompt and stream SSE events back."
    }
  ],
  "deployment": {
    "target": "nebius-compute",
    "instructions": "docs/deployment.md"
  },
  "nextRecipe": "short-term-memory-langchain",
  "authors": [
    { "name": "Clément Sauvage", "url": "https://clementsauvage.me" }
  ],
  "publishedAt": "2026-06-04",
  "updatedAt": "2026-06-04"
}
